{"diagnostics":[{"code":"E_VISUAL_TEXT_FIT","element_ids":["title"],"message":"title is close to the role budget","path":"$.svg.title","severity":"warning"},{"code":"E_VISUAL_DETERMINISM","element_ids":[],"message":"determinism receipt retained","path":"$.svg","severity":"info"}],"scene_sha256":"2222222222222222222222222222222222222222222222222222222222222222","schema_version":1,"spec_sha256":"1111111111111111111111111111111111111111111111111111111111111111","status":"pass","svg_sha256":"3333333333333333333333333333333333333333333333333333333333333333","count_consistency":{"pass":true,"mismatches":[],"scene_count":4,"claim_count":4,"inventory_count":7}}